{
  "id": "src_static_cninfo_com_cn_1159392e6f",
  "title": "关于董事长代行董事会秘书职责的公告",
  "publisher": "海南海药",
  "sourceType": "exchange",
  "url": "http://static.cninfo.com.cn/finalpage/2026-05-23/1225325500.PDF",
  "publishedAt": "2026-05-23",
  "capturedAt": "2026-07-23T09:50:52+08:00",
  "evidenceLevel": "A",
  "status": "active",
  "notes": "Official News Intake v0 from announcement_candidate_3574917b70a99d60; listSourceId=src_cninfo_000566_announcements."
}
