{
  "id": "src_static_cninfo_com_cn_7d113c811e",
  "title": "董事会薪酬与考核委员会关于2023年限制性股票激励计划预留授予部分第一个归属期归属名单的核查意见",
  "publisher": "寒武纪",
  "sourceType": "exchange",
  "url": "http://static.cninfo.com.cn/finalpage/2026-07-25/1225441721.PDF",
  "publishedAt": "2026-07-25",
  "capturedAt": "2026-07-25T16:17:49+08:00",
  "evidenceLevel": "A",
  "status": "active",
  "notes": "Official News Intake v0 from announcement_candidate_28339f899913e5a1; listSourceId=src_cninfo_688256_announcements."
}
