{
  "id": "src_static_cninfo_com_cn_f3c0e50229",
  "title": "江苏长电科技股份有限公司2026年半年度业绩预增公告",
  "publisher": "长电科技",
  "sourceType": "exchange",
  "url": "http://static.cninfo.com.cn/finalpage/2026-07-15/1225425008.PDF",
  "publishedAt": "2026-07-15",
  "capturedAt": "2026-07-23T09:50:52+08:00",
  "evidenceLevel": "A",
  "status": "active",
  "notes": "Official News Intake v0 from announcement_candidate_ec69ebc290148ff3; listSourceId=src_cninfo_600584_announcements."
}
