{
  "id": "src_static_cninfo_com_cn_140cc70419",
  "title": "关于2026年半年度计提资产减值准备的公告",
  "publisher": "太极实业",
  "sourceType": "exchange",
  "url": "http://static.cninfo.com.cn/finalpage/2026-08-27/1225513020.PDF",
  "publishedAt": "2026-08-27",
  "capturedAt": "2026-08-27T16:32:40+08:00",
  "evidenceLevel": "A",
  "status": "active",
  "notes": "Official News Intake v0 from announcement_candidate_fc3d1cb7be74fbd5; listSourceId=src_cninfo_600667_announcements."
}
