{
  "id": "src_ubtrobot_com_c704a93c68",
  "title": "UBTECH Robotics Collaborates with the University of Hong Kong for Joint Research on Human-like Visual Perception",
  "publisher": "UBTECH ROBOTICS CORP LTD",
  "sourceType": "news",
  "url": "https://www.ubtrobot.com/en/about/news/493495795167301",
  "publishedAt": "2023-12-15",
  "capturedAt": "2026-07-15T10:58:14+08:00",
  "evidenceLevel": "A",
  "status": "active",
  "notes": "Official News Intake v0 from news_candidate_1ed1b01ef7e5fb89; listSourceId=src_ubtech_official_news."
}
