{
  "id": "src_static_cninfo_com_cn_dd1677bad6",
  "title": "董事会薪酬与考核委员会关于公司股权激励相关事项的核查意见",
  "publisher": "三花智控",
  "sourceType": "exchange",
  "url": "http://static.cninfo.com.cn/finalpage/2026-07-18/1225430720.PDF",
  "publishedAt": "2026-07-18",
  "capturedAt": "2026-07-23T16:16:14+08:00",
  "evidenceLevel": "A",
  "status": "active",
  "notes": "Official News Intake v0 from announcement_candidate_e78eb04a36e9ba05; listSourceId=src_cninfo_002050_announcements."
}
