{
  "id": "src_static_cninfo_com_cn_93d3ee7cd0",
  "title": "紫金矿业集团股份有限公司关于召开2025年年度股东会的通知",
  "publisher": "紫金矿业",
  "sourceType": "exchange",
  "url": "http://static.cninfo.com.cn/finalpage/2026-05-16/1225309069.PDF",
  "publishedAt": "2026-05-16",
  "capturedAt": "2026-07-23T09:50:52+08:00",
  "evidenceLevel": "A",
  "status": "active",
  "notes": "Official News Intake v0 from announcement_candidate_80073a8469684666; listSourceId=src_cninfo_601899_announcements."
}
