{
  "id": "src_static_cninfo_com_cn_7d770737f5",
  "title": "大唐发电关于召开2026年度中期业绩说明会的公告",
  "publisher": "大唐发电",
  "sourceType": "exchange",
  "url": "http://static.cninfo.com.cn/finalpage/2026-08-18/1225477755.PDF",
  "publishedAt": "2026-08-18",
  "capturedAt": "2026-08-18T16:15:56+08:00",
  "evidenceLevel": "A",
  "status": "active",
  "notes": "Official News Intake v0 from announcement_candidate_8d648bd4e351f863; listSourceId=src_cninfo_601991_announcements."
}
