{
  "id": "src_static_cninfo_com_cn_7af3fb3c88",
  "title": "关于公司2025年股票期权与限制性股票激励计划股票期权第一个行权期行权条件成就、限制性股票第一个解除限售期解除限售条件成就、回购注销部分已获授但尚未解除限售的限制性股票及注销部分尚未行权的股票期权事项的法律意见书",
  "publisher": "埃斯顿",
  "sourceType": "exchange",
  "url": "http://static.cninfo.com.cn/finalpage/2026-08-12/1225468414.PDF",
  "publishedAt": "2026-08-12",
  "capturedAt": "2026-08-12T16:17:44+08:00",
  "evidenceLevel": "A",
  "status": "active",
  "notes": "Official News Intake v0 from announcement_candidate_770028829dcdf0b5; listSourceId=src_cninfo_002747_announcements."
}
