{
  "id": "src_static_cninfo_com_cn_7edebe9d28",
  "title": "关于独立董事及高管变更的公告",
  "publisher": "双林股份",
  "sourceType": "exchange",
  "url": "http://static.cninfo.com.cn/finalpage/2026-07-04/1225407994.PDF",
  "publishedAt": "2026-07-04",
  "capturedAt": "2026-07-15T11:03:07+08:00",
  "evidenceLevel": "A",
  "status": "active",
  "notes": "Official News Intake v0 from announcement_candidate_1fd30a9b0dc38d47; listSourceId=src_cninfo_300100_announcements."
}
