{
  "id": "src_static_cninfo_com_cn_b5d9b1a96a",
  "title": "北京市金杜律师事务所关于内蒙古兴业银锡矿业股份有限公司2025年年度股东会之法律意见书",
  "publisher": "兴业银锡",
  "sourceType": "exchange",
  "url": "http://static.cninfo.com.cn/finalpage/2026-07-01/1225401213.PDF",
  "publishedAt": "2026-07-01",
  "capturedAt": "2026-07-23T09:50:52+08:00",
  "evidenceLevel": "A",
  "status": "active",
  "notes": "Official News Intake v0 from announcement_candidate_9a9a2a3b52079a3e; listSourceId=src_cninfo_000426_announcements."
}
