{
  "id": "src_static_cninfo_com_cn_b5b91e8d1c",
  "title": "中芯国际2025年第一季度报告",
  "publisher": "中芯国际",
  "sourceType": "exchange",
  "url": "http://static.cninfo.com.cn/finalpage/2025-05-09/1223496514.PDF",
  "publishedAt": "2025-05-09",
  "capturedAt": "2026-07-23T09:56:01+08:00",
  "evidenceLevel": "A",
  "status": "active",
  "notes": "Official News Intake v0 from announcement_candidate_731632c434a7e6f1; listSourceId=src_cninfo_688981_announcements."
}
