{
  "id": "src_static_cninfo_com_cn_3fddeed8ca",
  "title": "中国石化H股公告-翌日披露表格",
  "publisher": "中国石化",
  "sourceType": "exchange",
  "url": "http://static.cninfo.com.cn/finalpage/2026-08-04/1225454365.PDF",
  "publishedAt": "2026-08-04",
  "capturedAt": "2026-08-04T16:16:54+08:00",
  "evidenceLevel": "A",
  "status": "active",
  "notes": "Official News Intake v0 from announcement_candidate_8b3bb01e254bc19f; listSourceId=src_cninfo_600028_announcements."
}
