{
  "id": "src_static_cninfo_com_cn_0f69b19bcf",
  "title": "2025年年度股东会决议公告",
  "publisher": "国际实业",
  "sourceType": "exchange",
  "url": "http://static.cninfo.com.cn/finalpage/2026-05-08/1225282012.PDF",
  "publishedAt": "2026-05-08",
  "capturedAt": "2026-07-23T09:50:52+08:00",
  "evidenceLevel": "A",
  "status": "active",
  "notes": "Official News Intake v0 from announcement_candidate_b007c9a1c2d02207; listSourceId=src_cninfo_000159_announcements."
}
