{
  "id": "src_static_cninfo_com_cn_7730cf16a1",
  "title": "2024年年度报告",
  "publisher": "华大九天",
  "sourceType": "exchange",
  "url": "http://static.cninfo.com.cn/finalpage/2025-04-28/1223320656.PDF",
  "publishedAt": "2025-04-28",
  "capturedAt": "2026-07-23T09:56:01+08:00",
  "evidenceLevel": "A",
  "status": "active",
  "notes": "Official News Intake v0 from announcement_candidate_38402cd3837cd48d; listSourceId=src_cninfo_301269_announcements."
}
