{
  "id": "src_static_cninfo_com_cn_8b783a7330",
  "title": "哈药集团股份有限公司股票交易异常波动公告",
  "publisher": "哈药股份",
  "sourceType": "exchange",
  "url": "http://static.cninfo.com.cn/finalpage/2026-08-12/1225468270.PDF",
  "publishedAt": "2026-08-12",
  "capturedAt": "2026-08-12T16:17:44+08:00",
  "evidenceLevel": "A",
  "status": "active",
  "notes": "Official News Intake v0 from announcement_candidate_aa24354fd79a7e89; listSourceId=src_cninfo_600664_announcements."
}
