{
  "id": "src_static_cninfo_com_cn_d98c583378",
  "title": "新疆国际实业股份有限公司信息披露暂缓与豁免管理制度(2026年修订)",
  "publisher": "国际实业",
  "sourceType": "exchange",
  "url": "http://static.cninfo.com.cn/finalpage/2026-06-06/1225353666.PDF",
  "publishedAt": "2026-06-06",
  "capturedAt": "2026-07-23T09:31:19+08:00",
  "evidenceLevel": "A",
  "status": "active",
  "notes": "Official News Intake v0 from announcement_candidate_0763f92519abac4b; listSourceId=src_cninfo_000159_announcements."
}
